[
  {
    "id": "thug",
    "name": "街头混混",
    "armorType": "light",
    "baseHp": 60000,
    "baseWallet": 32000,
    "speed": 2000,
    "flying": false,
    "stealResist": 0,
    "dodge": 0,
    "bountyRatio": { "gold": 170, "wood": 0 },
    "isBoss": false,
    "sprite": "enemies/thug",
    "description": "轻甲、慢速。教学波段的基础敌人，血量系数 ×1.0 / 钱包系数 ×1.0。"
  },
  {
    "id": "bat",
    "name": "蝙蝠",
    "armorType": "light",
    "baseHp": 42000,
    "baseWallet": 35200,
    "speed": 4000,
    "flying": true,
    "stealResist": 0,
    "dodge": 0,
    "bountyRatio": { "gold": 170, "wood": 0 },
    "isBoss": false,
    "sprite": "enemies/bat",
    "description": "飞行、快速、低血。血量系数 ×0.7 / 钱包系数 ×1.1。空中单位需要覆盖射程而非堆攻击。"
  },
  {
    "id": "heavy_brute",
    "name": "重装打手",
    "armorType": "heavy",
    "baseHp": 108000,
    "baseWallet": 41600,
    "speed": 2000,
    "flying": false,
    "stealResist": 0,
    "dodge": 0,
    "bountyRatio": { "gold": 170, "wood": 0 },
    "isBoss": false,
    "sprite": "enemies/heavy_brute",
    "description": "重甲、慢速、高血量（×1.8）。钱包系数 ×1.3。魔法攻击对它 ×1.5。"
  },
  {
    "id": "armored_car",
    "name": "装甲车",
    "armorType": "fortified",
    "baseHp": 150000,
    "baseWallet": 64000,
    "speed": 1200,
    "flying": false,
    "stealResist": 0,
    "dodge": 0,
    "bountyRatio": { "gold": 170, "wood": 0 },
    "isBoss": false,
    "sprite": "enemies/armored_car",
    "description": "城甲、极慢、极高血量（×2.5）。钱包系数 ×2.0。只有攻城攻击能高效击穿。"
  },
  {
    "id": "elite_assassin",
    "name": "精英刺客",
    "armorType": "medium",
    "baseHp": 72000,
    "baseWallet": 80000,
    "speed": 4000,
    "flying": false,
    "stealResist": 0,
    "dodge": 150,
    "bountyRatio": { "gold": 170, "wood": 0 },
    "isBoss": false,
    "sprite": "enemies/elite_assassin",
    "description": "中甲、快速、闪避 15%。钱包系数 ×2.5——窃金爆发点。"
  },
  {
    "id": "merchant_lock",
    "name": "铁钱袋商人",
    "armorType": "heavy",
    "baseHp": 120000,
    "baseWallet": 64000,
    "speed": 3000,
    "flying": false,
    "stealResist": 700,
    "dodge": 0,
    "bountyRatio": { "gold": 170, "wood": 0 },
    "isBoss": false,
    "sprite": "enemies/merchant_lock",
    "description": "重甲、中速、高血量（×2.0）。窃金抗性 70%、钱包系数 ×2.0。需要训导主任「罚站」或补输出塔。"
  },
  {
    "id": "temple_guard",
    "name": "圣殿守卫",
    "armorType": "divine",
    "baseHp": 150000,
    "baseWallet": 96000,
    "speed": 3000,
    "flying": false,
    "stealResist": 0,
    "dodge": 0,
    "bountyRatio": { "gold": 170, "wood": 0 },
    "isBoss": false,
    "sprite": "enemies/temple_guard",
    "description": "神圣甲、中速、高血量（×2.5）。钱包系数 ×3.0。普通/穿刺/攻城只造成 30% 伤害，只有混乱攻击全额。"
  },
  {
    "id": "boss_behemoth",
    "name": "荒兽",
    "armorType": "fortified",
    "baseHp": 360000,
    "baseWallet": 384000,
    "speed": 2000,
    "flying": false,
    "stealResist": 0,
    "dodge": 0,
    "bountyRatio": { "gold": 170, "wood": 0 },
    "isBoss": true,
    "hooks": ["aura_speed", "boss_drop"],
    "sprite": "enemies/boss_behemoth",
    "description": "BOSS（第 24 波）。城甲、慢速、血量系数 ×6。光环：周围敌人移速 +20%。★ 钱包系数 ×12（契约 §13.5 裁决：不得为 1.0，否则形成经济断崖）。"
  },
  {
    "id": "boss_inner_demon",
    "name": "心魔",
    "armorType": "medium",
    "baseHp": 360000,
    "baseWallet": 384000,
    "speed": 3000,
    "flying": false,
    "stealResist": 0,
    "dodge": 0,
    "bountyRatio": { "gold": 170, "wood": 0 },
    "isBoss": true,
    "hooks": ["split", "boss_drop"],
    "sprite": "enemies/boss_inner_demon",
    "description": "BOSS（第 25 波）。中甲、中速、血量系数 ×6。死亡时分裂为 2 个半血分身。钱包系数 ×12（契约 §13.5）。策划案原文写「英雄甲」（5 类护甲枚举中不存在），主策划裁决改为 medium：中甲抵抗穿刺/魔法/攻城、只弱于普通与混乱，正好惩罚 AoE、奖励单体爆发，并逼玩家建军训系（普通攻击）——强化 Q1 假设。"
  },
  {
    "id": "boss_reincarnator",
    "name": "转生者",
    "armorType": "divine",
    "baseHp": 240000,
    "baseWallet": 512000,
    "speed": 3000,
    "flying": false,
    "stealResist": 0,
    "dodge": 0,
    "bountyRatio": { "gold": 170, "wood": 0 },
    "isBoss": true,
    "hooks": ["revive", "boss_drop"],
    "sprite": "enemies/boss_reincarnator",
    "description": "BOSS（第 26 波）。神圣甲、血量系数 ×4（复活一次、50% 血量 → 等效 ×6）。钱包系数 ×16（契约 §13.5）。"
  },
  {
    "id": "ascendant",
    "name": "飞升者",
    "armorType": "divine",
    "baseHp": 480000,
    "baseWallet": 640000,
    "speed": 4000,
    "flying": true,
    "stealResist": 1000,
    "dodge": 0,
    "bountyRatio": { "gold": 170, "wood": 0 },
    "isBoss": true,
    "hooks": ["steal_immune", "boss_drop"],
    "sprite": "enemies/ascendant",
    "description": "最终 BOSS（第 27/30 波）。神圣甲、飞行、窃金免疫 100%、血量系数 ×8、钱包系数 ×20（契约 §13.5）。因窃金免疫，其钱包只能通过 bountyRatio（击杀奖励 17%）转化为收益。必须用混乱攻击（飞贼 T5 / 英雄）击杀。"
  }
]
